StringID,English_Translator,Screenshot,Note,English,ChineseTrad,ChineseSimp,Japanese,Korean,Danish,Dutch,French,German,Italian,Norwegian,Russian,Spanish,Swedish,Turkish,Portuguese
CHALLENGE_TOURNAMENT_RULES_MAIN_DESC_Special7,the land is shrouded in darkness. your shadow clone will be extra powerful!,,Broken shots,The land is shrouded in darkness. Your Shadow Clone will be extra powerful!,土地在黑暗中籠罩著。你的影子克隆將是額外的強大！,土地在黑暗中笼罩着。你的影子克隆将是额外的强大！,土地は暗闇の中で覆われています。あなたのシャドウクローンは余分に強力になるでしょう！,그 땅은 어둠 속에서 가려져 있습니다. 당신의 그림자 복제는 여분의 강력합니다!,Landet er indhyllet i mørket. Din skygge klon vil være ekstra kraftfuld!,Het land is gehuld in de duisternis. Je schaduwkloon is extra krachtig!,la terre est enveloppée dans l'obscurité. Votre clonage d'ombre sera très puissant!,Das Land ist in der Dunkelheit gehüllt. Ihr Schattenklon wird extra mächtig sein!,La terra è avvolta nell'oscurità. Il tuo clone shadow sarà extra potente!,Landet er innhyllet i mørket. Din skygge klone vil være ekstra kraftig!,Земля окутана тьмой. Твой тень клон будет очень мощным!,La tierra está envuelta en la oscuridad. ¡Tu clon de sombra será extra potente!,Landet är höljet i mörkret. Din skuggklon kommer att bli extra kraftfull!,Arazi karanlıkta örtülmüştür. Gölge klonun ekstra güçlü olacak!,A terra é envolta na escuridão. Seu clone de sombra será extra poderoso!
CHALLENGE_TOURNAMENT_RULES_MAIN_TITLE_Special8,ultra metabolic growth,,,Ultra Metabolic Growth,超代謝生長,超代谢生长,超代謝成長,초 대사 성장,Ultra Metabolisk Vækst,Ultra Metabole Groei,Croissance Ultra Métabolique,Ultra Metabolisches Wachstum,Crescita Ultra Metabolica,Ultra Metabolsk Vekst,Ультра Метаболический Рост,Crecimiento Ultra Metabólico,Ultra Metabolisk Tillväxt,Ultra Metabolik Büyüme,Crescimento Ultra Metabólico
CHALLENGE_TOURNAMENT_RULES_MAIN_DESC_Special8,everything is pulsing with mutagenic energy! you feel unstoppable.,,Broken shots,Everything is pulsing with mutagenic energy! You feel unstoppable.,一切都與誘變能量脈動！你覺得勢不可擋。,一切都与诱变能量脉动！你觉得势不可挡。,すべてが変異原性エネルギーでパルスされました！あなたは止められない感じ。,모든 돌연변이 에너지 펄스입니다! 당신은 멈출 생각합니다.,alt er pulserer med mutagene energi! du føler ustoppelig.,alles pulseert met mutagene energie! je voelt je niet te stoppen.,tout est palpite avec l'énergie mutagène! vous vous sentez imparable.,alles pulsiert mit mutagenen Energie! Sie fühlen sich nicht mehr aufzuhalten.,tutto pulsa di energia mutageno! ti senti inarrestabile.,alt er pulserende med mutagene energi! du føler ustoppelig.,все пульсирует с мутагенной энергией! Вы чувствуете неудержим.,todo lo que está pulsando con energía mutagénico! se siente imparable.,allt pulserar med mutagen energi! du känner dig ostoppbar.,Her şey mutajenik enerji ile darbe olduğunu! Eğer durdurulamaz hissediyorum.,tudo está pulsando com energia mutagênico! você se sentir imparável.
THROWBACKBLACKSMITHBUNDLE_TITLE,get extra damage for every equipment set!,,,Get Extra Damage For Every Equipment Set!,每套裝備都會受到額外傷害！,每套装备都会受到额外伤害！,装備セットごとに追加ダメージを獲得しましょう！,모든 장비 세트에 대해 추가 피해를 받으세요!,Få Ekstra Skade For Hvert Udstyrssæt!,Krijg Extra Schade Voor Elke Uitrustingsset!,Obtenez Des Dégâts Supplémentaires Pour Chaque Ensemble D'Équipement !,Erhalte Zusätzlichen Schaden Für Jedes Ausrüstungsset!,Ottieni Danni Extra Per Ogni Set Di Equipaggiamento!,Få Ekstra Skade For Hvert Utstyrssett!,Получайте Дополнительный Урон За Каждый Комплект Снаряжения!,¡Obtén Daño Adicional Por Cada Conjunto De Equipo!,Få Extra Skada För Varje Utrustningsuppsättning!,Her Ekipman Seti Için Ekstra Hasar Alın!,Obtenha Dano Extra Para Cada Conjunto De Equipamentos!
THROWBACKBLACKSMITHBUNDLE_CATCH_DESC,Unlock the Wondrous Forgemaster legendary Set,,"Contains Legendary Set:
<color=#FF0045>Wondrous Forgemaster</color>","Contains Legendary Set:
<color=#FF0045>Wondrous Forgemaster</color>",解鎖奇妙的鍛造大師傳奇套裝,解锁奇妙的锻造大师传奇套装,素晴らしいフォージマスターの伝説的なセットをアンロックする,Wonderful Forgemaster 전설적인 세트를 잠금 해제하세요,Lås Op For Wonders Forgemaster Legendariske Sæt,Ontgrendel De Wonderbaarlijke Legendarische Forgemaster-Set,Débloquez L'Ensemble Légendaire Wondrous Forgemaster,Schalte Das Legendäre Set Wundersamer Schmiedemeister Frei,Sblocca Il Set Leggendario Meraviglioso Mastro Forgiatore,Lås Opp Det Legendariske Wonder Forgemaster-Settet,Разблокируйте Легендарный Комплект «Чудесный Мастер Кузни»,Desbloquea El Conjunto Legendario Wondrous Forgemaster,Lås Upp Wonders Forgemaster Legendariska Set,Harika Forgemaster Efsanevi Setinin Kilidini Açın,Desbloqueie O Conjunto Lendário Maravilhoso Forgemaster
GLOBALRAIDVICTORY6BUNDLE_TITLE,global victory bundle!,,,Global Raid Victory Bundle!,全球胜利捆綁！,全球胜利捆绑！,グローバルレイドビクトリーバンドル！,글로벌 습격 승리 번들!,Bundle Af Sejr!,Globale Raid-Overwinningsbundel!,Bundle De Victoire!,Global Raubzug-Sieg Bündel!,Bundle Di Vittoria Global Raid!,Seier Bunt!,Глобальный Пакет Победы Raid!,Paquete De Victoria!,Seger Bunt!,Global Raid Zafer Paketi!,Pacote De Vitória!
GLOBALRAIDVICTORY6BUNDLE_CATCH_DESC,celebrate victory with this limited time deal!,,,Celebrate victory with this limited time deal!,用這個有限的時間交易慶祝勝利！,用这个有限的时间交易庆祝胜利！,この限られた時間取引で勝利を祝いましょう！,이 제한된 시간 거래로 승리를 축하하십시오!,Fejre sejr med denne begrænsede tid aftale!,Vier de overwinning met deze beperkte tijd deal!,Célébrez la victoire avec cette offre limitée du temps!,Feiern Sie den Sieg mit dieser begrenzten Zeit!,Festeggia la vittoria con questo periodo di tempo limitato!,Feire seier med denne begrensede tilbudet!,Отпразднуйте победу с этим ограниченным временем!,¡Celebre la victoria con este acuerdo de tiempo limitado!,Fira seger med denna begränsade tidsavtal!,Bu sınırlı zaman anlaşmasıyla zaferi kutlayın!,Comemore a vitória com este negócio de tempo limitado!
MAY2024LIMBBUNDLE_TITLE,limb breaker bundle,,,Limb Breaker Bundle,肢斷路器束,肢断路器束,四肢ブレーカーバンドル,사지 차단기 번들,lem breaker bundle,ledematen breaker bundel,faisceau de coupe membre,Extremität breaker Bündel,arto interruttore fascio,lem breaker bunt,расслоение выключателя конечности,extremidad haz disyuntor,lem breaker knippe,bacak kesici demeti,pacote disjuntor membro
MAY2024LIMBBUNDLE_CATCH_DESC,enough cards and dust to reach level 15 each!,,,"Devastate Those Raid Titans!
Enough Cards and Dust to reach Level 15 Each!",足夠的卡片和灰塵達到15級！,足够的卡片和灰尘达到15级！,それぞれのレベル15に達するのに十分なカードとほこりがあります！,각각 레벨 15에 도달 할 수있는 충분한 카드와 먼지!,Nok Kort Og Støv For At Nå Niveau 15 Hver!,Genoeg Kaarten En Stof Om Elk Niveau 15 Te Bereiken!,Assez De Cartes Et De Poussière Pour Atteindre Le Niveau 15 Chacun!,"Genug Karten Und Staub, Um Je Level 15 Zu Erreichen!",Abbastanza Carte E Polvere Per Raggiungere Il Livello 15 Ciascuno!,Nok Kort Og Støv For Å Nå Nivå 15 Hver!,"Достаточно Карточек И Пыль, Чтобы Достичь Уровня 15 Каждый!",¡Basas Cartas Y Polvo Para Alcanzar El Nivel 15 Cada Uno!,Tillräckliga Kort Och Damm För Att Nå Nivå 15 Vardera!,Her Biri 15 Seviyeye Ulaşacak Kadar Kart Ve Toz!,Cartões E Poeira Suficientes Para Alcançar O Nível 15 Cada!
MAY2024SKILLPOINTBUNDLE_TITLE,ultimate skill point bundle,,,Ultimate Skill Point Bundle,終極技能點束,终极技能点束,究極のスキルポイントバンドル,궁극의 스킬 포인트 번들,ultimative skill point bundt,ultieme vaardigheidspunt bundel,faisceau de point de compétence ultime,ultimative Fertigkeitspunkt Bündel,punto fascio finale giocata,ultimate ferdighetspoeng bunt,Точка расслоение Конечного умения,punto de haz última habilidad,ultimata skill point bunt,Nihai beceri noktası demeti,feixe ponto final habilidade
MAY2024SKILLPOINTBUNDLE_CATCH_DESC,give your skills a big boost!,,,Give your skills a big boost!,給你的技能大的推動作用！,给你的技能大的推动作用！,あなたのスキルに大きな弾みをつけます！,당신의 능력에게 큰 활력을 불어 넣을!,give dine færdigheder et stort løft!,geef uw vaardigheden een grote boost!,donner à vos compétences un grand coup de pouce!,geben Sie Ihre Fähigkeiten einen großen Schub!,dare le vostre abilità di una grande spinta!,gi dine ferdigheter et stort løft!,дать свои навыки большой импульс!,dar a sus habilidades un gran impulso!,ge dina kunskaper ett stort uppsving!,senin becerileri büyük bir destek vermek!,dar suas habilidades de um grande impulso!