StringID,English_Translator,Screenshot,Note,English,ChineseTrad,ChineseSimp,Japanese,Korean,Danish,Dutch,French,German,Italian,Norwegian,Russian,Spanish,Swedish,Turkish,Portuguese
TEST_UPDATE_STRING1,Test Update String 1,,,Test Update String 1,測試更新字符串1,测试更新字符串1,更新文字列1をテストします,테스트 업데이트 문자열 1,Testopdateringsstreng 1,Test Update String 1,Test Update String 1,Aktualisierungszeichenfolge 1,Test Aggiornamento String 1,Testoppdateringsstreng 1,Тестовое обновление строки 1,Prueba de actualización de actualización 1,Testuppdateringssträng 1,Test Güncelleme Dizesi 1,String de atualização de teste 1
BONUS_DESC_ShadowCloneAllSkillBoost,Increases the strength of your Spells while Shadow Clone is active.,,,Increases the strength of your Spells while Shadow Clone is active.,當影子克隆處於活動狀態時，會增加咒語的強度。,当影子克隆处于活动状态时，会增加咒语的强度。,シャドウクローンがアクティブになっている間、呪文の強度を高めます。,그림자 클론이 활성화되는 동안 주문의 강도를 높입니다.,"Øger styrken på dine trylleformularer, mens skygge klon er aktiv.",Verhoogt de sterkte van je spreuken terwijl Shadow Clone actief is.,Augmente la force de vos sorts tandis que l'ombre du clone est active.,"Erhöht die Stärke Ihrer Zauber, während der Schattenklon aktiv ist.",Aumenta la forza dei tuoi incantesimi mentre Shadow Clone è attivo.,Øker styrken på stavene dine mens Shadow Clone er aktiv.,"Увеличивает силу ваших заклинаний, в то время как теневой клон активен.",Aumenta la fuerza de tus hechizos mientras que el clon de sombra está activo.,Ökar styrkan hos dina trollformler medan skuggklonen är aktiv.,Gölge klonu aktifken büyülerinizin gücünü arttırır.,Aumenta a força de seus feitiços enquanto o clone de sombra está ativo.
TWILIGHTBUNDLE_CATCH_DESC,"reduce your mystical impact cost
increase your twilight damage",,,"Reduce your Mystical Impact Cost
Increase your Twilight Damage","降低您的神秘影響成本
增加暮光傷害","降低您的神秘影响成本
增加暮光伤害","神秘的な影響コストを削減します
トワイライトダメージを増やします","신비로운 충격 비용을 줄입니다
황혼의 손상을 늘리십시오","Reducer Dine Mystiske Påvirkningsomkostninger
Forøg Din Skumringsskade","Verlaag Uw Mystieke Impactkosten
Verhoog Uw Schemeringschade","Réduisez Votre Coût D'Impact Mystique
Augmentez Vos Dégâts De Crépuscule","Reduzieren Sie Ihre Mystischen Auswirkungenkosten
Erhöhen Sie Ihren Dämmerungsschaden","Riduci Il Tuo Costo Di Impatto Mistico
Aumenta Il Tuo Danno Da Crepuscolo","Reduser Din Mystiske Påvirkningskostnad
Øk Skumrene Dine","Уменьшите Свою Мистическую Стоимость Воздействия
Увеличьте Свой Сумертный Урон","Reduzca Su Costo De Impacto Místico
Aumenta Tu Daño Crepuscular","Minska Din Mystiska Påverkan
Öka Din Skymningsskada","Mistik Etki Maliyetinizi Azaltın
Alacakaranlık Hasarınızı Artırın","Reduza Seu Custo De Impacto Místico
Aumente Seu Dano Do Crepúsculo"
ARTIFACT_NAME_SeasonalArtifact43,hierophant's library,,,Hierophant's Library,神父的圖書館,神父的图书馆,Hierophantの図書館,Hierophant의 도서관,Hierophants Bibliotek,De Bibliotheek Van Hirophant,Bibliothèque De Hiérophant,Hierophants Bibliothek,Biblioteca Di Herofant,Hierophants Bibliotek,Библиотека Иерофанта,Biblioteca De Hierofante,Hierophants Bibliotek,Hierophant'In Kütüphanesi,Biblioteca Da Hierofante
FIRSTMATEBUNDLE_CATCH_DESC,"increase your clan loyalty!
increase your armor gold!",,,"Increase your Clan Loyalty!
Increase your Armor Gold!","提高您的氏族忠誠度！
增加您的盔甲黃金！","提高您的氏族忠诚度！
增加您的盔甲黄金！","一族の忠誠心を高めてください！
鎧の金を増やしてください！","클랜 충성도를 높이십시오!
갑옷 금을 늘리십시오!","Forøg Din Klanloyalitet!
Forøg Dit Rustningsguld!","Verhoog Uw Clanloyaliteit!
Verhoog Je Pantsergoud!","Augmentez La Fidélité De Votre Clan!
Augmentez Votre Or D'Armure!","Erhöhen Sie Ihre Clan -Loyalität!
Erhöhen Sie Ihr Rüstungsgold!","Aumenta La Lealtà Del Tuo Clan!
Aumenta L'Oro Dell'Armatura!","Øk Klan -Lojaliteten Din!
Øk Rustningen Din Gull!","Увеличьте Лояльность Клана!
Увеличьте Золото Брони!","¡Aumenta La Lealtad De Tu Clan!
¡Aumenta Tu Armadura De Oro!","Öka Din Klanlojalitet!
Öka Ditt Rustningsguld!","Klan Sadakatinizi Artırın!
Zırh Altınızı Artırın!","Aumente Sua Lealdade Do Clã!
Aumente O Ouro Da Sua Armadura!"
SLOT_NAME_CHANGE_PLACEHOLDER_TEXT,​,,,​,​,​,​,​,​,​,​,​,​,​,​,​,​,​,​
BONUS_DESC_TwilightFairyStageSkip,Increases the number of stages you skip each time you defeat a Boss Titan with Twilight Fairy.,,,Increases the number of stages you skip each time you defeat a Boss Titan with Twilight Fairy.,每次用暮光仙子擊敗老闆泰坦時，都會增加您跳過的階段數。,每次用暮光仙子击败老板泰坦时，都会增加您跳过的阶段数。,トワイライトフェアリーでボスタイタンを倒すたびにスキップする段階の数を増やします。,Twilight Fairy로 보스 타이탄을 물리 칠 때마다 건너 뛰는 단계의 수를 증가시킵니다.,"Øger antallet af faser, du springer over, hver gang du besejrer en boss Titan med Twilight Fairy.",Verhoogt het aantal fasen dat u overslaat telkens wanneer u een Boss Titan verslaat met Twilight Fairy.,Augmente le nombre d'étapes que vous sautez chaque fois que vous battez un boss Titan avec Twilight Fairy.,"Erhöht die Anzahl der Phasen, die Sie jedes Mal überspringen, wenn Sie einen Boss Titan mit Twilight Fairy besiegen.",Aumenta il numero di fasi che salti ogni volta che sconfiggi un boss Titan con Twilight Fairy.,Øker antallet trinn du hopper over hver gang du beseirer en Boss Titan med Twilight Fairy.,"Увеличивает количество этапов, которые вы пропускаете каждый раз, когда вы побеждаете босса Титана с сумеречной феей.",Aumenta la cantidad de etapas que omitas cada vez que derrotas a un titán jefe con Twilight Fairy.,Ökar antalet steg du hoppar över varje gång du besegrar en chef Titan med Twilight Fairy.,Twilight Fairy ile bir patron Titan'ı her yendiğinizde atladığınız aşama sayısını artırır.,Aumenta o número de estágios que você pula cada vez que derrota um titã -chefe com o Twilight Fairy.