StringID,English_Translator,Screenshot,Note,English,ChineseTrad,ChineseSimp,Japanese,Korean,Danish,Dutch,French,German,Italian,Norwegian,Russian,Spanish,Swedish,Turkish,Portuguese
TEST_UPDATE_STRING1,Test Update String 1,,,Test Update String 1,測試更新字符串1,测试更新字符串1,更新文字列1をテストします,테스트 업데이트 문자열 1,Testopdateringsstreng 1,Test Update String 1,Test Update String 1,Aktualisierungszeichenfolge 1,Test Aggiornamento String 1,Testoppdateringsstreng 1,Тестовое обновление строки 1,Prueba de actualización de la cadena 1,Testuppdateringssträng 1,Test Güncelleme Dizesi 1,String de atualização de teste 1
NEW_CONTENT_PANEL_TITLE,welcome to v6.8,,,Welcome to v6.8,歡迎來到V6.8,欢迎来到V6.8,V6.8へようこそ,V6.8에 오신 것을 환영합니다,Velkommen Til V6.8,Welkom Bij V6.8,Bienvenue À V6.8,Willkommen Bei V6.8,Benvenuti In V6.8,Velkommen Til V6.8,Добро Пожаловать В V6.8,Bienvenido A V6.8,Välkommen Till V6.8,V6.8'E Hoş Geldiniz,Bem -Vindo Ao V6.8
NEW_CONTENT_TEXT_TITLE,buntron activate!,,,Buntron Activate!,Buntron激活！,Buntron激活！,Buntron Activate！,Buntron 활성화!,Buntron Aktiverer!,Buntron Activeer!,Buntron Activer!,Buntron Aktivieren!,Buntron Attiva!,Buntron Aktiver!,Бунтрон Активируется!,Buntron Activar!,Buntron Aktivera!,Buntron Etkinleştir!,Buntron Ative!
NEW_CONTENT_TEXT_DESC,"hop into action with the all-new legendary set, buntron-xt-7! take your pet builds to the next level, letting you sit back and watch as your fluffy companions do the work.",,,"Hop into action with the all-new legendary set, Buntron-XT-7! Take your pet builds to the next level, letting you sit back and watch as your fluffy companions do the work.",與全新的傳奇套裝Buntron-XT-7一起採取行動！將您的寵物建造成一個新的水平，讓您坐下來觀察蓬鬆的同伴做這項工作。,与全新的传奇套装Buntron-XT-7一起采取行动！将您的宠物建造成一个新的水平，让您坐下来观察蓬松的同伴做这项工作。,まったく新しい伝説的なセット、Buntron-xt-7でアクションに飛び乗ってください！あなたのペットのビルドを次のレベルに持って行って、あなたのふわふわの仲間が仕事をするのをあなたを座って見てみましょう。,완전히 새로운 전설적인 세트 인 Buntron-XT-7으로 행동하십시오! 애완 동물 빌드를 다음 단계로 끌어 올려 앉아서 푹신한 동반자가 일을하는 것을 지켜 볼 수 있습니다.,"Hop til handling med det helt nye legendariske sæt, Buntron-Xt-7! Tag dine kæledyrsbygninger til det næste niveau, så du kan læne dig tilbage og se, mens dine fluffy ledsagere gør arbejdet.","Spring in actie met de geheel nieuwe legendarische set, Buntron-Txt-7! Neem uw huisdierbuild naar een hoger niveau en laat u achterover leunen en kijken terwijl uw donzige metgezellen het werk doen.","Savoir en action avec le tout nouvel ensemble légendaire, Buntron-XT-7! Faites en sorte que vos constructions d'animaux au niveau suivant, vous permettant de vous asseoir et de regarder vos compagnons moelleux faire le travail.","Steigen Sie mit dem brandneuen legendären Set Buntron-Xt-7 in Aktion! Bringen Sie Ihre Haustier -Builds auf die nächste Stufe und lassen Sie sich zurücklehnen und beobachten, wie Ihre flauschigen Gefährten die Arbeit erledigen.","Salta in azione con il nuovissimo set leggendario, Buntron -t-7! Porta le tue build per animali domestici al livello successivo, permettendoti di sederti e guardare mentre i tuoi soffici compagni fanno il lavoro.","Hop til aksjon med det helt nye legendariske settet, Buntron-XT-7! Ta kjæledyret ditt til neste nivå, og la deg lene deg tilbake og se på mens dine fluffy følgesvenner gjør jobben.","Запрыгивайте в действие с совершенно новым легендарным набором, Buntron-ST-7! Отнесите свои питометра на следующий уровень, позволяя вам сидеть сложа руки и наблюдать, как ваши пушистые спутники делают работу.","¡Súbete a la acción con el nuevo conjunto legendario, Buntron-XT-7! Lleve las construcciones de su mascota al siguiente nivel, permitiéndole sentarse y ver cómo sus compañeros esponjosos hacen el trabajo.","Hoppa till handling med den helt nya legendariska uppsättningen, BUNTRON-XT-7! Ta ditt husdjursbyggnad till nästa nivå, låt dig luta dig tillbaka och titta när dina fluffiga följeslagare gör jobbet.","Yepyeni efsanevi set olan Buntron-XT-7 ile harekete geçin! Evcil hayvan yapılarınızı bir sonraki seviyeye taşıyın, arkanıza yaslanıp kabarık arkadaşlarınızın işi yaparken izlemenize izin verin.","Entre em ação com o novo conjunto lendário, Buntron-XT-7! Leve o seu animal de estimação para o próximo nível, deixando você sentar e observar seus companheiros fofos fazem o trabalho."
BONUS_MagicPotionDamageRate,amplify damage per second,,,Amplify Damage Per Second,每秒放大傷害,每秒放大伤害,1秒あたりの損傷を増幅します,초당 손상을 증폭시킵니다,Forstærk Skader Pr. Sekund,Versterken De Schade Per Seconde,Amplifier Les Dégâts Par Seconde,Schäden Pro Sekunde Verstärken,Amplificare Il Danno Al Secondo,Amplify Skade Per Sekund,Увеличить Урон В Секунду,Amplificar El Daño Por Segundo,Förstärka Skador Per Sekund,Saniyede Hasarı Yükseltmek,Amplificar Danos Por Segundo
EQUIPMENT_PER_DAY_BONUS_DESCR,gain {0} each day (maximum effect of {1}). this set begins accumulating power when you unlock it.,,,Gain {0} each day (maximum effect of {1}). This set begins accumulating power when you unlock it.,每天獲得{0}（{1}的最大效果）。解鎖時，該集合開始積累功率。,每天获得{0}（{1}的最大效果）。解锁时，该集合开始积累功率。,毎日ゲイン{0}（{1}の最大効果）。このセットは、ロックを解除すると蓄積され始めます。,매일 {0}를 얻습니다 ({1}의 최대 효과). 이 세트는 잠금을 해제 할 때 축적 전력을 시작합니다.,"Gain {0} hver dag (maksimal effekt af {1}). Dette sæt begynder at samle strømmen, når du låser det op.",ga elke dag {0} (maximaal effect van {1}). Deze set begint de kracht te verzamelen wanneer u deze ontgrendelt.,gain {0} chaque jour (effet maximum de {1}). Cet ensemble commence à accumuler de la puissance lorsque vous le déverrouillez.,"Gewinne {0} jeden Tag (maximale Wirkung von {1}). Dieses Set beginnt, Strom zu sammeln, wenn Sie sie entsperren.",guadagno {0} ogni giorno (effetto massimo di {1}). Questo set inizia ad accumulare potenza quando lo sblocchi.,Gevinst {0} hver dag (maksimal effekt på {1}). Dette settet begynner å samle strøm når du låser opp det.,"Получите {0} каждый день (максимальный эффект {1}). Этот набор начинает накапливаться, когда вы разблокируете его.",Gane {0} cada día (efecto máximo de {1}). Este conjunto comienza a acumular poder cuando la desbloquea.,Få {0} varje dag (maximal effekt av {1}). Denna uppsättning börjar samla kraft när du låser upp den.,"Her gün {0} kazanın ({1} maksimum etkisi). Bu set, kilidini açtığınızda biriken güç başlar.",ganho {0} a cada dia (efeito máximo de {1}). Este conjunto começa a acumular poder quando você o desbloqueia.